reform_id,country_code,country_name,survey_year,implementation_year,announcement_year,announcement_year_source,announcement_year_confidence,legislation_year,legislation_year_source,legislation_year_confidence,implementation_year_end,implementation_year_source,implementation_year_confidence,theme,sub_theme,secondary_type,alternative_theme,rd_actor,rd_stage,growth_orientation,growth_orientation_rationale,growth_orientation_confidence,package_name,component_name,is_component,status,status_evidence,status_confidence,is_major_reform,importance_bucket,importance_rationale,importance_confidence,description,source_quote,source_page_start,source_page_end
DNK_2021_002,DNK,Denmark,2021,2020.0,,,,,,,,explicit,high,innovation,sectoral_rd,innovation_instruments,,public_private,applied,growth_supporting,"The strategy supports innovation in clean technologies, enhancing sustainability and economic growth.",high,Green Transition Strategy,EUDP and Innovation Fund Support,False,implemented,Programmes like EUDP are already in operation.,high,True,3,The strategy represents a major overhaul of Denmark's approach to clean technology R&D.,high,"Denmark is implementing a comprehensive strategy to support research and development in clean technologies, aiming to cut carbon emissions by 70% by 2030. This includes attracting private investment, enhancing public-private cooperation, and focusing on missions such as carbon capture, power-to-X, and eco-friendly agriculture. Major programmes like the Energy Technology Development and Demonstration Programme (EUDP) are central to this effort.","The green research strategy is focused on four missions: 1) carbon capture, utilisation and storage, 2) power-to-X, 3) climate and eco-friendly agriculture and food production, 4) recycling and reduction of plastic waste.",89.0,89.0
DNK_2021_004,DNK,Denmark,2021,2020.0,2020.0,explicit,high,,,,,explicit,high,innovation,innovation_instruments,,,private,applied,growth_supporting,"The tax incentive encourages private sector investment in R&D, boosting innovation.",high,R&D Tax Incentive Enhancement,R&D Tax Allowance Increase,False,implemented,The tax allowance was applied in 2020 and extended.,high,False,2,The temporary increase is a significant incentive for private R&D investment.,medium,"Denmark temporarily increased the R&D enhanced tax allowance to 130% for R&D expenses up to DKK 850 million in 2020 and 2021, later extended to 2022.",The package also included a temporary increase in the R&D enhanced tax allowance to 130% in 2020 and 2021 (later extended to 2022) for R&D expenses up to DKK 850 million.,20.0,20.0
DNK_2021_001,DNK,Denmark,2021,,2022.0,explicit,high,,,,,,,innovation,innovation_instruments,,,public,adoption,growth_supporting,"The strategy aims to enhance digital infrastructure and capabilities, supporting innovation and productivity.",high,Digitalisation Strategy 2022,,False,announced,Official announcement for 2022 launch.,high,False,1,The strategy is a targeted initiative to improve digitalisation.,medium,A new digitalisation strategy will be launched in early 2022 based on the Digitization Partnership recommendations.,A new digitalisation strategy will be launched in early 2022 on the basis of the Digitization Partnership recommendations released in October 2021.,44.0,44.0
DNK_2021_003,DNK,Denmark,2021,,2021.0,imputed_survey_year,high,,,,,,,innovation,sectoral_rd,,,public,applied,growth_supporting,The strategy aims to reduce emissions and promote sustainable practices in agriculture and industry.,high,Green Research Strategy,Agricultural R&D for Emission Reduction,False,announced,Official announcements of investment plans.,high,False,2,The strategy is significant for its focus on sustainable practices and emissions reduction.,medium,"Denmark is investing in research and development to enhance agriculture's contribution to a net-zero target, focusing on alternatives to greenhouse gas intensive practices and improving emissions monitoring. The green research strategy also emphasizes developing green fuels and Power-to-X technologies.","In the longer term, research and development can contribute to provide alternatives to GHG intensive practices and therefore abate emissions with limited leakage effects.",121.0,121.0
DNK_2021_005,DNK,Denmark,2021,,2020.0,explicit,high,,,,,,,innovation,rd_funding,sectoral_rd,,public_private,applied,growth_supporting,"The plan supports green innovation and technology scaling, contributing to sustainable economic growth.",high,Green Recovery and Investment Plan,Green R&D Funding,False,announced,Official announcements of funding allocations.,high,False,2,The plan provides significant funding for green R&D and innovation.,medium,"The Danish government announced a Green recovery plan, which includes substantial support for research and development of green technologies, with DKK 3,900 million allocated for this purpose. Additionally, a trans-partisan agreement allocated DKK 6 billion to the Danish Green Investment Fund to promote green innovation and scale up technologies in five key areas.",A trans-partisan agreement between the Danish Government and other parties allocated DKK 6 billion to the Danish Green Investment Fund.,,
DNK_2021_006,DNK,Denmark,2021,,,,,,,,,,,innovation,sectoral_rd,,,public,applied,growth_supporting,Continued investment in wind energy supports renewable energy development and sustainability.,high,Wind Energy Support Programme,Wind R&D Funding,False,implemented,Ongoing funding and support for wind energy.,high,False,1,The programme is a continuation of existing support for wind energy.,medium,"The Danish government has sustained support for wind research, development, and deployment, with significant subsidies and increasing funding throughout the 2000s, peaking at DKK 618 million in 2013.","Sustained support for wind research, development and deployment, with significant subsidies in the late 1970s and 1980s and increasing funding throughout the 2000s, peaking at DKK 618 million in 2013.",103.0,103.0
DNK_2021_007,DNK,Denmark,2021,,,,,,,,,,,innovation,research_infrastructure,sectoral_rd,,public_private,adoption,growth_supporting,The development of wind energy islands and charging infrastructure supports renewable energy and sustainable transport.,high,Infrastructure and Energy Transition Plan,North Sea Wind Energy Island,False,announced,Official plans for infrastructure development.,high,True,3,The plan involves large-scale infrastructure projects with significant investment.,high,"The Danish government is planning to develop two wind energy islands to provide renewable electricity and sustainable fuels, with the first stage of the North Sea project estimated at EUR 29 billion. Additionally, a 10-year funding program for fast chargers on the trunk road network is part of the Infrastructure Plan 2035.","The Danish government is planning to develop two wind energy islands, an artificial island in the North Sea and the Baltic island of Bornholm, to provide renewable electricity, sustainable fuels and interconnection with other countries.",104.0,104.0
